<?xml version="1.0"?>
<families xmlns="fam" xmlns:x="http://www.w3.org/2001/XMLSchema-instance" x:schemaLocation="fam families.xsd" >
    <family>
        <name>Leduc</name>
        <address>
            <streetname>MyStreet</streetname>
            <housenumber>8</housenumber>
            <postcode>9999</postcode>
            <city>SomeCity</city>
        </address>
        <members>
            <member gender="MALE">
                <firstname>person 1</firstname>
                <lastname>persons 1 last name</lastname>
            </member>
            <member gender="FEMALE">
                <firstname>person 2</firstname>
                <lastname>person 2 last name</lastname>
                <gender>FEMALE</gender>
            </member>
        </members>
        <pets>
            <pet>
                <name species="DOG">Jef</name>
            </pet>
        </pets>
    </family>
</families>